{
  "schemaVersion": "1.0.0",
  "serviceId": "aadhaar-address-update",
  "primaryScenarioId": "scenario_aadhaar_address_update_online_poa",
  "cells": {
    "cost": {
      "state": "stated",
      "claimIds": [
        "claim_ind70_fee_display",
        "claim_ind70_fee_addendum_online_address_75"
      ],
      "searchedRoutes": [],
      "note": "The primary online own-proof-of-address address-change route costs ₹75. UIDAI separately charges ₹75 for a centre demographic/address update performed alone and makes the demographic component free when combined with biometric update; neither that conditional centre zero nor the separate Document update waiver changes the primary route's ₹75 fee."
    },
    "documents": {
      "state": "stated",
      "claimIds": [
        "claim_ind70_poa_required_and_upload",
        "claim_ind70_update_poa_definition",
        "claim_ind70_update_poa_current",
        "claim_ind70_update_poa_issued_to_holder",
        "claim_ind70_update_poa_verifiable"
      ],
      "searchedRoutes": [],
      "note": "Use an applicable List IV proof-of-address document containing the applicant's name and Indian address; it must be current, issued to the person seeking update, and verifiable. The online route requires upload of the supporting PoA document."
    },
    "eligibility": {
      "state": "stated",
      "claimIds": [
        "claim_ind70_registered_mobile_requirement",
        "claim_ind70_aadhaar_number_login",
        "claim_ind70_registered_mobile_otp",
        "claim_ind70_online_own_poa_route"
      ],
      "searchedRoutes": [],
      "note": "This route is for an Aadhaar number holder with a mobile number registered in Aadhaar, who can log in with the Aadhaar number and OTP and directly request an address update using supporting PoA."
    },
    "time": {
      "state": "stated",
      "claimIds": [
        "claim_ind70_time_display"
      ],
      "searchedRoutes": [],
      "note": "The public Update Address route displayed 'Up to 30 days'. This is an actionable route-level duration, but the unauthenticated observation did not establish the authenticated start and end events used to measure it."
    },
    "owner": {
      "state": "stated",
      "claimIds": [
        "claim_ind70_quality_processing_team_review"
      ],
      "searchedRoutes": [],
      "note": "UIDAI identifies a quality and processing team as conducting the later verification of the uploaded PoA against the requested data."
    },
    "after-submission": {
      "state": "stated",
      "claimIds": [
        "claim_ind70_online_submission_srn",
        "claim_ind70_online_submission_invoice",
        "claim_ind70_status_login"
      ],
      "searchedRoutes": [],
      "note": "On successful submission, the FAQ states that an SRN is shown and sent by SMS, an invoice with the SRN can be downloaded, and status is available after login."
    }
  }
}
