{
  "schemaVersion": "1.0.0",
  "serviceId": "property-tax-payment",
  "primaryScenarioId": "scenario_property_tax_payment_known_sas_pid",
  "cells": {
    "cost": {
      "state": "mentioned",
      "claimIds": [
        "claim_ind72_public_service_online_payment"
      ],
      "searchedRoutes": [
        "https://bbmptax.karnataka.gov.in/pages/service_details.aspx"
      ],
      "note": "The reviewed service-details route mentions online payment but provides no citizen-paid amount or actionable fee schedule."
    },
    "documents": {
      "state": "absent",
      "claimIds": [],
      "searchedRoutes": [
        "https://bbmptax.karnataka.gov.in/pages/service_details.aspx"
      ],
      "note": "The reviewed service-details route does not identify a document that the citizen must submit, provide, upload, produce, or attach."
    },
    "eligibility": {
      "state": "stated",
      "claimIds": [
        "claim_ind72_service_eligibility"
      ],
      "searchedRoutes": [],
      "note": "The actionable rule is that the online service is for property owners within Bengaluru City Corporation limits."
    },
    "time": {
      "state": "mentioned",
      "claimIds": [],
      "searchedRoutes": [
        "https://bbmptax.karnataka.gov.in/pages/service_details.aspx"
      ],
      "note": "The reviewed service-details route touches assessment-year timing but no actionable duration, deadline, processing period, or service-level target is captured."
    },
    "owner": {
      "state": "mentioned",
      "claimIds": [],
      "searchedRoutes": [
        "https://bbmptax.karnataka.gov.in/pages/service_details.aspx"
      ],
      "note": "The reviewed route names Bengaluru City Corporations/GBA and a head-office contact topic, but no claim identifies the office or operational role that holds or decides a case."
    },
    "after-submission": {
      "state": "stated",
      "claimIds": [
        "claim_ind72_public_service_confirmation",
        "claim_ind72_public_service_receipt_generation"
      ],
      "searchedRoutes": [],
      "note": "After payment, the published procedure says the citizen receives real-time payment confirmation and a generated receipt."
    }
  }
}
