{
  "schemaVersion": "1.0.0",
  "serviceId": "water-connection",
  "primaryScenarioId": "scenario_ind32_water_residential",
  "cells": {
    "cost": {
      "state": "stated",
      "claimIds": [
        "claim_delhi_water_domestic_charges_table",
        "claim_delhi_water_domestic_charges_table_2",
        "claim_delhi_water_domestic_charges_table_3",
        "claim_delhi_water_domestic_charges_table_4",
        "claim_delhi_water_domestic_charges_table_5",
        "claim_delhi_water_domestic_charges_table_6",
        "claim_delhi_water_application_form_fee",
        "claim_delhi_water_application_form_fee_2",
        "claim_delhi_water_development_charges_unauthorised_colonies",
        "claim_delhi_water_development_charges_unauthorised_colonies_2",
        "claim_delhi_water_doorstep_fee",
        "claim_delhi_water_doorstep_fee_2"
      ],
      "searchedRoutes": [],
      "note": "The FAQ publishes a line-by-line schedule of amounts the citizen pays in the domestic category, which is this scenario's category: application fee Rs. 10, opening fee Rs. 250 water and Rs. 250 sewer, trade advance Rs. 5,000, occupier security Rs. 500 water and Rs. 500 sewer, and road restoration Rs. 1,600 water and Rs. 3,200 sewer where the distance from the property to the DJB network is up to 5 metres. Two further amounts are route-specific rather than general: the fixed development charge of Rs. 45,000 or Rs. 1,00,000 applies only in unauthorised regularised colonies, which a scoped applicant may or may not live in, and the Rs. 50 doorstep fee only on the optional doorstep route. The FAQ also gives Rs. 10 for the application form and processing; the reviewed evidence does not establish whether that is the same Rs. 10 as the table's application fee, and this ledger does not resolve it. The schedule is not established as exhaustive: no claim in this ledger records what is payable where the distance to the network exceeds 5 metres, and that gap is recorded here as a limitation on the reviewed evidence, not as a finding about what the route says."
    },
    "documents": {
      "state": "stated",
      "claimIds": [
        "claim_delhi_water_identity_and_ownership_documents",
        "claim_delhi_water_simplified_document_list",
        "claim_delhi_water_simplified_document_list_2",
        "claim_delhi_water_simplified_document_list_3",
        "claim_delhi_water_simplified_document_list_4",
        "claim_delhi_water_form_photo_and_id_upload"
      ],
      "searchedRoutes": [],
      "note": "Concrete documents are named with a requirement to produce them: a proof of identity document and a property ownership document as a condition of sanction, an enumerated list of acceptable identity proofs plus the last three months' paid electricity bills and an undertaking for the colony categories the charter names, and a passport-size photograph on the online form. The enumerated list is written for unauthorised or regularised colonies, urban and rural villages and slum katras; for a property outside those categories only the identity-and-ownership condition is stated."
    },
    "eligibility": {
      "state": "stated",
      "claimIds": [
        "claim_delhi_water_who_can_apply",
        "claim_delhi_water_who_can_apply_2",
        "claim_delhi_water_who_can_apply_3",
        "claim_delhi_water_who_can_apply_4",
        "claim_delhi_water_network_precondition",
        "claim_delhi_water_network_precondition_2",
        "claim_delhi_water_no_arrears_precondition",
        "claim_delhi_water_completed_authorised_construction",
        "claim_delhi_water_completed_authorised_construction_2",
        "claim_delhi_water_completed_authorised_construction_3",
        "claim_delhi_water_one_connection_per_dwelling",
        "claim_delhi_water_one_connection_per_dwelling_2"
      ],
      "searchedRoutes": [],
      "note": "Rules decide who qualifies and which route applies: any resident of Delhi who owns or occupies the premises with identity and ownership proof, outside the NDMC and Cantonment areas; the Board's network must already reach the colony; there must be no accumulated arrears on the property; construction must be complete and authorised, with no connection on a vacant plot; and one connection per dwelling unit up to a building height of 15 metres."
    },
    "time": {
      "state": "stated",
      "claimIds": [
        "claim_delhi_water_charter_delivery_time_fifteen_days",
        "claim_delhi_water_doorstep_timeframe",
        "claim_delhi_water_demand_payment_deadline",
        "claim_delhi_water_demand_payment_deadline_2",
        "claim_delhi_water_demand_payment_deadline_3"
      ],
      "searchedRoutes": [],
      "note": "An actionable service-level target is published: the charter's table of services gives 15 days for a new water and sewer connection, and the charter gives the same 15 days for the doorstep route, where its wording ties the figure to sanction of the connection. The figure therefore covers one stage only. The reviewed evidence publishes no figure for anything that follows sanction, and this ledger records that a demand raised by the ZRO office must then be paid within fifteen days or the sanction is withdrawn — a deadline binding on the applicant, not a service-level target on the Board. What is required after that payment, and how long it takes, is not established by the reviewed evidence and is recorded here as a limitation. Both charter figures rest on a source whose currency is not established by the document and which audit grades C; the only Grade B figure in this cell is the applicant's own payment deadline."
    },
    "owner": {
      "state": "stated",
      "claimIds": [
        "claim_delhi_water_officer_responsible_zro",
        "claim_delhi_water_zro_approves_sanction",
        "claim_delhi_water_zro_office_directory_published"
      ],
      "searchedRoutes": [],
      "note": "The citizen can identify the office that decides: the charter names the Zonal Revenue Officer concerned as the officer responsible for this service, the FAQ confirms sanction rests on the ZRO's approval, and the Board publishes a directory of designated ZRO offices with addresses and the assembly constituencies each covers, so the office can be found from the property's location."
    },
    "after-submission": {
      "state": "stated",
      "claimIds": [
        "claim_delhi_water_public_status_tracking_route",
        "claim_delhi_water_public_status_tracking_route_2",
        "claim_delhi_water_public_status_tracking_route_3",
        "claim_delhi_water_public_status_tracking_route_4",
        "claim_delhi_water_portal_tracking_facility_listed"
      ],
      "searchedRoutes": [],
      "note": "A visible post-submission surface exists and is public: a Track Application Status route that takes a new-connection reference number and returns the application status with a dated list of actions performed and remarks, listed in the charter among the portal's 24x7 facilities. The route was read, not queried; no reference number was entered. What the applicant is shown at sanction or refusal is separately recorded as unknown."
    }
  }
}
